{"analysis":{"accepted_input":"dependency_algebra.ir.CanonicalIR","analysis_id":"dependency-algebra.dependency-analysis","analysis_version":"1","deterministic_configuration":{},"implementation_identity":"dependency_algebra.analysis.DependencyAnalysisPass","output_contract_identity":"dependency_algebra.ir.AnalysisResult:dependency-algebra.analysis.v1","specification_references":["SPEC.md","DEPENDENCY_PREDICATE_CONTRACT.md#dependency-predicate-definition","REACHABILITY_CONTRACT.md#reachability-definition","DETERMINISM.md#dependency-predicate-determinism","registry/traceability.json"]},"artifact_hash":"sha256:1e249914ab3b96ac7863fe0ad202c11faeb78cee5e475625c5aed1f7c2da4c6f","artifact_schema_version":"dependency-algebra.structural-evidence.v2","diagnostics":[],"input":{"normalized_ir_hash":"sha256:29b93307194409c117c5514036a36ed83fc25f755ec87b8d7b7199f266aedbb2","source_topology_hash":"sha256:aa2b3327c271457e53041ea876b3edfde6f45cc2175fd1d29d228e32fcbd0696"},"provenance":{"compiler_package_version":"0.1.0"},"result":{"payload":{"classification":"VALID","dependencies":[{"candidate_set":["cache"],"dependency":false,"dependency_reason":"structurally_valid_path_remaining_after_projection","dependency_result_hash":"sha256:76bb5fe2a9c50fd089b00938ba9132cb2c096e981addad15268959f275035e8a","diagnostics":[],"normalized_ir_hash":"sha256:29b93307194409c117c5514036a36ed83fc25f755ec87b8d7b7199f266aedbb2","projected_ir_hash":"sha256:5279402e4d52822b7202b8ee316266fe8bc548391a6cec76066ab844117a5bc7","reachability_result_hash":"sha256:647c54ccbf24dd14b9870cababd3505b898baea88ce21744614814da09d1e5bf","reachable_after_projection":["api","client","database"],"roots":["client"],"schema_version":"dependency-algebra.dependency.v1","target":"database","workload_id":"serve-api"}],"dependency_result_hash":"sha256:3cb0ec3484d53044c02e3e089c5a44fd1ecc0df69b397f0acb96c8e584ba920d","normalized_ir_hash":"sha256:29b93307194409c117c5514036a36ed83fc25f755ec87b8d7b7199f266aedbb2","reachability":{"normalized_ir_hash":"sha256:29b93307194409c117c5514036a36ed83fc25f755ec87b8d7b7199f266aedbb2","reachability_result_hash":"sha256:11d0a47ad500932170ae9d3d92ed317cfb50570baed3bfc7b00829a11d2e3868","results":[{"diagnostics":[],"reachable":true,"reached_by":["client"],"roots":["client"],"target":"database","traversal_edges":[{"edge_id":"api-database","from":"api","to":"database"},{"edge_id":"client-api","from":"client","to":"api"}],"visited_nodes":["api","client","database"],"workload_id":"serve-api"}],"schema_version":"dependency-algebra.reachability.v1","topology_id":"minimal-valid"},"schema_version":"dependency-algebra.analysis.v1","topology_id":"minimal-valid"},"result_hash":"sha256:3cb0ec3484d53044c02e3e089c5a44fd1ecc0df69b397f0acb96c8e584ba920d","validation_contract":"dependency-algebra.result-validation.v1","validation_status":"VALIDATED"}}